{
  "schema_version": "1.0.0",
  "record_id": "claim:sample.order-created",
  "statement": "Submitting a valid synthetic order returns the created state in the approved lab scenario.",
  "version_scope": {
    "product_version": "sample-build-1",
    "scope_or_module": "scope:sample.orders",
    "environment_id": "environment:sample.lab",
    "valid_from": "2026-01-15T09:00:00Z",
    "valid_to": null
  },
  "claim_status": "runtime-confirmed",
  "confidence": "medium",
  "confidence_rationale": "The approved scenario was reproduced, while other roles and configurations remain outside scope.",
  "evidence_relations": [
    {
      "relation": "supports",
      "evidence_id": "evidence:sample.order-response"
    }
  ],
  "validation_method": {
    "method_id": "method:sample.claim-boundary-review",
    "description": "Review the statement against its version boundary and evidence relations.",
    "reproducible": true
  },
  "owner": "Sample product analyst",
  "last_updated": "2026-01-15"
}
